{
  "$schema": "../../../../conf/v5/schema.json",
  "baseDir": ".",
  "linking": {
    "paths": "relative",
    "mentions": "first-in-paragraph"
  },
  "glossaries": [
    {
      "file": "./glossary.md"
    }
  ],
  "ignoreCase": false,
  "outDir": "../../../output-actual/config-linking/mentions-first-in-paragraph",
  "dev": {
    "termsFile": "../../../output-actual/config-linking/mentions-first-in-paragraph/terms.json",
    "reproducablePaths": true
  }
}
