{
  "$schema": "../../../../../conf/v5/schema.json",
  "baseDir": ".",
  "outDir": "../../../../output-actual/config-linking/pathRewrites-relative/array-change-file-ext",
  "glossaries": [{
    "file": "./**/*.md"
  }],
  "linking": {
    "paths": "relative",
    "pathRewrites": {
      ".html": [".md"]
    },
    "byReferenceDefinition": false
  }
}
