{
  "$schema": "../../../../conf/v5/schema.json",
  "baseDir": ".",
  "linking": {
    "paths": "relative",
    "mentions": "all"
  },
  "includeFiles": [
    "."
  ],
  "excludeFiles": [],
  "generateFiles": {
    "indexFile": {
      "file": "./index.md"
    }
  },
  "glossaries": [
    {
      "file": "./glossary.md"
    }
  ],
  "ignoreCase": false,
  "outDir": "../../../output-actual/config-indexFile/issue-75-formatted-headings",
  "dev": {
    "printInputAst": false,
    "reproducablePaths": true,
    "printOutputAst": false
  }
}
