{
  "$schema": "../../../../conf/v5/schema.json",
  "baseDir": ".",
  "outDir": "../../../output-actual/config-linking/by-heading-id",
  "linking": {
    "paths": "relative",
    "mentions": "all"
  },
  "includeFiles": ["."],
  "excludeFiles": [],
  "glossaries": [{ "file": "./**/*.md" } ],
  "ignoreCase": false
}
