{
  "$schema": "../../../../conf/v5/schema.json",
  "baseDir": "./",
  "outDir": "../../../output-actual/term-uris/uri-none-baseUrl-none-paths-relative/",
  "glossaries": [{
      "file": "./sub-1/sub-2/glossary.md"
  }],
  "linking": {
    "paths": "relative",
    "pathComponents": ["path", "file"]
  },
  "dev": {
    "termsFile": "./terms.json"
  }
}
