{
  "$schema": "../../../../../conf/v5/schema.json",
  "baseDir": ".",
  "outDir": "../../../../output-actual/config-glossaries/import-csv/with-headers-missing",
  "glossaries": [{
    "file": "./glossary.md",
    "import": {
      "file": "./glossary.csv"
    }
  }],
  "dev": {
    "termsFile": "../../../../output-actual/config-glossaries/import-csv/with-headers-missing/terms.json"
  }
}
