{
  "$schema": "../../../../conf/v5/schema.json",
  "baseDir": ".",
  "linking": {
    "paths": "absolute",
    "mentions": "all",
    "baseUrl": "http://example.org"
  },
  "outDir": "../../../output-actual/config-linking/baseUrl/",
  "includeFiles": [
    "."
  ],
  "excludeFiles": [],
  "glossaries": [
    {
      "file": "./glossary.md",
      "termHint": ""
    },
    {
      "file": "./sub-1/glossary.md",
      "termHint": ""
    }
  ],
  "ignoreCase": false,
  "dev": {
    "termsFile": "../../../output-actual/config-linking/baseUrl/terms.json",
    "printInputAst": false,
    "reproducablePaths": true,
    "printOutputAst": false
  }
}
